<?xml version="1.0" encoding="UTF-8" standalone="no"?>
<!DOCTYPE tournament SYSTEM "tournament.dtd">
<tournament>
    <name>tourney2</name>
    <type>Single Elimination</type>
    <numTeams>12</numTeams>
    <regStartDate>2016-11-15</regStartDate>
    <regEndDate>2016-11-18</regEndDate>
    <startDate>2016-11-22</startDate>
    <endDate>2016-11-22</endDate>
    <minPlayerAge>14</minPlayerAge>
    <maxPlayerAge>24</maxPlayerAge>
</tournament>
