<?xml version="1.0" encoding="UTF-8" standalone="no"?>
<!DOCTYPE tournament SYSTEM "tournament.dtd">
<tournament>
    <id>2</id>
    <name>Tomi's tourney</name>
    <type>Divisions</type>
    <numTeams>7</numTeams>
    <regStartDate>2016-11-01</regStartDate>
    <regEndDate>2016-11-06</regEndDate>
    <startDate>2016-12-08</startDate>
    <endDate>2016-12-08</endDate>
    <minPlayerAge>15</minPlayerAge>
    <maxPlayerAge>30</maxPlayerAge>
    <teamList>
        <team>
            <teamName>demo 2</teamName>
            <player>
                <name>dfghdfgh</name>
                <age>15</age>
            </player>
            <player>
                <name>gwrgbsr</name>
                <age>16</age>
            </player>
            <player>
                <name>bsfb</name>
                <age>15</age>
            </player>
            <player>
                <name>sfdbsfdb</name>
                <age>15</age>
            </player>
            <player>
                <name>s</name>
                <age>15</age>
            </player>
            <player>
                <name>sfbsfgbsgb</name>
                <age>15</age>
            </player>
        </team>
        <team>
            <teamName>demo 3</teamName>
            <player>
                <name>dfghdfgh</name>
                <age>15</age>
            </player>
            <player>
                <name>gwrgbsr</name>
                <age>16</age>
            </player>
            <player>
                <name>bsfb</name>
                <age>15</age>
            </player>
            <player>
                <name>sfdbsfdb</name>
                <age>15</age>
            </player>
            <player>
                <name>s</name>
                <age>15</age>
            </player>
            <player>
                <name>sfbsfgbsgb</name>
                <age>15</age>
            </player>
        </team>
        <team>
            <teamName>demo 4</teamName>
            <player>
                <name>dfghdfgh</name>
                <age>15</age>
            </player>
            <player>
                <name>gwrgbsr</name>
                <age>16</age>
            </player>
            <player>
                <name>bsfb</name>
                <age>15</age>
            </player>
            <player>
                <name>sfdbsfdb</name>
                <age>15</age>
            </player>
            <player>
                <name>s</name>
                <age>15</age>
            </player>
            <player>
                <name>sfbsfgbsgb</name>
                <age>15</age>
            </player>
        </team>
        <team>
            <teamName>demo 5</teamName>
            <player>
                <name>dfghdfgh</name>
                <age>15</age>
            </player>
            <player>
                <name>gwrgbsr</name>
                <age>16</age>
            </player>
            <player>
                <name>bsfb</name>
                <age>15</age>
            </player>
            <player>
                <name>sfdbsfdb</name>
                <age>15</age>
            </player>
            <player>
                <name>s</name>
                <age>15</age>
            </player>
            <player>
                <name>sfbsfgbsgb</name>
                <age>15</age>
            </player>
        </team>
    <team>
            <teamName>demo 6</teamName>
            <player>
                <name>sfhsfgb</name>
                <age>15</age>
            </player>
            <player>
                <name>sfnsb</name>
                <age>15</age>
            </player>
            <player>
                <name>sgnsgn</name>
                <age>15</age>
            </player>
            <player>
                <name>fndf</name>
                <age>15</age>
            </player>
            <player>
                <name>sfgfgb</name>
                <age>15</age>
            </player>
            <player>
                <name>sfgsfgb</name>
                <age>15</age>
            </player>
        </team>
    <team>
            <teamName>demo 7s</teamName>
            <player>
                <name>gbsfgbsf</name>
                <age>15</age>
            </player>
            <player>
                <name>sfbsfb</name>
                <age>15</age>
            </player>
            <player>
                <name>sgfbb</name>
                <age>15</age>
            </player>
            <player>
                <name>sgsfgb</name>
                <age>15</age>
            </player>
            <player>
                <name>sgbsfgb</name>
                <age>15</age>
            </player>
            <player>
                <name>sgbsfgbgfb</name>
                <age>15</age>
            </player>
            <player>
                <name>sgbshrnhmg</name>
                <age>15</age>
            </player>
        </team>
    <team>
            <teamName>dgdfgbd</teamName>
            <player>
                <name>ndgbndgh</name>
                <age>15</age>
            </player>
            <player>
                <name>hdgnd</name>
                <age>15</age>
            </player>
            <player>
                <name>fhjm</name>
                <age>15</age>
            </player>
            <player>
                <name>fhjmfy</name>
                <age>15</age>
            </player>
            <player>
                <name>fjfh</name>
                <age>15</age>
            </player>
            <player>
                <name>fhmfhjm</name>
                <age>15</age>
            </player>
        </team>
    </teamList>
</tournament>
