<?xml version="1.0" encoding="UTF-8" standalone="no"?>
<!DOCTYPE tournament SYSTEM "tournament.dtd">
<tournament>
    <id>1</id>
    <name>Dido's Tournament</name>
    <type>Single Elimination</type>
    <numTeams>6</numTeams>
    <regStartDate>2016-12-01</regStartDate>
    <regEndDate>2016-12-02</regEndDate>
    <startDate>2016-12-03</startDate>
    <endDate>2016-12-03</endDate>
    <minPlayerAge>10</minPlayerAge>
    <maxPlayerAge>20</maxPlayerAge>
    <teamList>
        <team>
            <teamName>Team 1</teamName>
            <player>
                <name>Dido</name>
                <age>10</age>
            </player>
            <player>
                <name>Dido</name>
                <age>10</age>
            </player>
            <player>
                <name>Dido</name>
                <age>10</age>
            </player>
            <player>
                <name>Dido</name>
                <age>10</age>
            </player>
            <player>
                <name>Dido</name>
                <age>10</age>
            </player>
            <player>
                <name>Dido</name>
                <age>10</age>
            </player>
        </team>
    <team>
            <teamName>Team 2</teamName>
            <player>
                <name>Dido</name>
                <age>10</age>
            </player>
            <player>
                <name>Dido</name>
                <age>10</age>
            </player>
            <player>
                <name>Dido</name>
                <age>10</age>
            </player>
            <player>
                <name>Dido</name>
                <age>10</age>
            </player>
            <player>
                <name>Dido</name>
                <age>10</age>
            </player>
            <player>
                <name>Dido</name>
                <age>10</age>
            </player>
        </team>
    <team>
            <teamName>Team 3</teamName>
            <player>
                <name>Dido</name>
                <age>10</age>
            </player>
            <player>
                <name>Dido</name>
                <age>10</age>
            </player>
            <player>
                <name>Dido</name>
                <age>10</age>
            </player>
            <player>
                <name>Dido</name>
                <age>10</age>
            </player>
            <player>
                <name>Dido</name>
                <age>10</age>
            </player>
            <player>
                <name>Dido</name>
                <age>10</age>
            </player>
        </team>
    <team>
            <teamName>Team 4</teamName>
            <player>
                <name>Dido</name>
                <age>10</age>
            </player>
            <player>
                <name>Dido</name>
                <age>10</age>
            </player>
            <player>
                <name>Dido</name>
                <age>10</age>
            </player>
            <player>
                <name>Dido</name>
                <age>10</age>
            </player>
            <player>
                <name>Dido</name>
                <age>10</age>
            </player>
            <player>
                <name>Dido</name>
                <age>10</age>
            </player>
        </team>
    <team>
            <teamName>Team 5</teamName>
            <player>
                <name>Dido</name>
                <age>10</age>
            </player>
            <player>
                <name>Dido</name>
                <age>10</age>
            </player>
            <player>
                <name>Dido</name>
                <age>10</age>
            </player>
            <player>
                <name>Dido</name>
                <age>10</age>
            </player>
            <player>
                <name>Dido</name>
                <age>10</age>
            </player>
            <player>
                <name>Dido</name>
                <age>10</age>
            </player>
        </team>
    <team>
            <teamName>hdgndg</teamName>
            <player>
                <name>dyhdng</name>
                <age>10</age>
            </player>
            <player>
                <name>dndtn</name>
                <age>10</age>
            </player>
            <player>
                <name>tkiktuk</name>
                <age>10</age>
            </player>
            <player>
                <name>rjrtyj</name>
                <age>10</age>
            </player>
            <player>
                <name>jtyey</name>
                <age>10</age>
            </player>
            <player>
                <name>eyhet</name>
                <age>10</age>
            </player>
        </team>
    </teamList>
</tournament>
