<?xml version="1.0" encoding="UTF-8" standalone="no"?>
<!DOCTYPE tournament SYSTEM "tournament.dtd">
<tournament>
    <id>1</id>
    <name>Test Tourney demo</name>
    <type>Divisions</type>
    <numTeams>6</numTeams>
    <regStartDate>2016-12-01</regStartDate>
    <regEndDate>2016-12-03</regEndDate>
    <startDate>2016-12-06</startDate>
    <endDate>2016-12-09</endDate>
    <minPlayerAge>10</minPlayerAge>
    <maxPlayerAge>22</maxPlayerAge>
    <teamList>
        <team>
            <teamName>Team1</teamName>
            <player>
                <name>hajosfk</name>
                <age>10</age>
            </player>
            <player>
                <name>asdadsasd</name>
                <age>10</age>
            </player>
            <player>
                <name>vddfdf</name>
                <age>10</age>
            </player>
            <player>
                <name>sdaasd</name>
                <age>10</age>
            </player>
            <player>
                <name>das</name>
                <age>10</age>
            </player>
            <player>
                <name>sadsda</name>
                <age>10</age>
            </player>
        </team>
    <team>
            <teamName>testTeam1</teamName>
            <player>
                <name>boy</name>
                <age>10</age>
            </player>
            <player>
                <name>dude</name>
                <age>10</age>
            </player>
            <player>
                <name>suh</name>
                <age>10</age>
            </player>
            <player>
                <name>fam</name>
                <age>10</age>
            </player>
            <player>
                <name>lit</name>
                <age>10</age>
            </player>
            <player>
                <name>brooo</name>
                <age>10</age>
            </player>
        </team>
    <team>
            <teamName>testTeam2</teamName>
            <player>
                <name>boy</name>
                <age>10</age>
            </player>
            <player>
                <name>dude</name>
                <age>10</age>
            </player>
            <player>
                <name>suh</name>
                <age>10</age>
            </player>
            <player>
                <name>fam</name>
                <age>10</age>
            </player>
            <player>
                <name>lit</name>
                <age>10</age>
            </player>
            <player>
                <name>brooo</name>
                <age>10</age>
            </player>
            <player>
                <name>nice</name>
                <age>10</age>
            </player>
            <player>
                <name>boy</name>
                <age>10</age>
            </player>
            <player>
                <name>play</name>
                <age>10</age>
            </player>
            <player>
                <name>google</name>
                <age>10</age>
            </player>
            <player>
                <name>apple</name>
                <age>10</age>
            </player>
            <player>
                <name>ai</name>
                <age>10</age>
            </player>
        </team>
    <team>
            <teamName>teamnew</teamName>
            <player>
                <name>kgfhg</name>
                <age>10</age>
            </player>
            <player>
                <name>kjhkjh</name>
                <age>10</age>
            </player>
            <player>
                <name>hbkjhbj</name>
                <age>10</age>
            </player>
            <player>
                <name>kjhvkhg</name>
                <age>10</age>
            </player>
            <player>
                <name>gdufytfg</name>
                <age>10</age>
            </player>
            <player>
                <name>luygugv</name>
                <age>10</age>
            </player>
        </team>
    <team>
            <teamName>demo team1</teamName>
            <player>
                <name>gsghs</name>
                <age>10</age>
            </player>
            <player>
                <name>dghjduj</name>
                <age>10</age>
            </player>
            <player>
                <name>ujeryujy</name>
                <age>10</age>
            </player>
            <player>
                <name>dhd</name>
                <age>10</age>
            </player>
            <player>
                <name>uetuyety</name>
                <age>10</age>
            </player>
            <player>
                <name>tdyjdth</name>
                <age>10</age>
            </player>
            <player>
                <name>rtjrtj</name>
                <age>10</age>
            </player>
        </team>
    <team>
            <teamName>demo team 2</teamName>
            <player>
                <name>sghdjhdt</name>
                <age>10</age>
            </player>
            <player>
                <name>etyuu</name>
                <age>10</age>
            </player>
            <player>
                <name>ryukruk</name>
                <age>10</age>
            </player>
            <player>
                <name>ryukru</name>
                <age>10</age>
            </player>
            <player>
                <name>totiotu</name>
                <age>10</age>
            </player>
            <player>
                <name>yktktuik</name>
                <age>10</age>
            </player>
        </team>
    </teamList>
</tournament>
