<?xml version="1.0" encoding="UTF-8" standalone="no"?>
<!DOCTYPE tournament SYSTEM "tournament.dtd">
<tournament>
    <name>tourney</name>
    <type>Divisions</type>
    <numTeams>7</numTeams>
    <regStartDate>2016-11-01</regStartDate>
    <regEndDate>2016-11-03</regEndDate>
    <startDate>2016-11-07</startDate>
    <endDate>2016-11-07</endDate>
    <minPlayerAge>13</minPlayerAge>
    <maxPlayerAge>23</maxPlayerAge>
</tournament>
